{"last_minute":96,"match_id":"synthetic-seed-43","model":"distance, top speed and sprints are computed from synthetic tracking data","players":[{"off_min":null,"on_min":0.0,"player_id":"HAR-1","position":"GK","shirt_no":1,"stats":{"ball_wins":[0,0,0,0,0,0,0,0,0,0,0,0,0,0,0,0,0,0,0,0,0,0,0,0,0,0,0,0,0,0,0,0,0,0,0,0,0,0,0,0,0,0,0,0,0,0,0,0,0,0,0,0,0,0,0,0,0,0,0,0,0,0,0,0,0,0,0,0,0,0,0,0,0,0,0,0,0,0,0,0,0,0,0,0,0,0,0,0,0,0,0,0,0,0,0,0,0],"distance_m":[0,41,116,138,178,233,308,356,411,456,488,551,612,679,743,758,796,862,925,968,1025,1076,1126,1239,1328,1394,1454,1495,1614,1674,1737,1795,1863,1977,2045,2105,2168,2229,2281,2355,2400,2461,2524,2579,2609,2647,2955,3006,3060,3120,3175,3286,3355,3418,3489,3551,3619,3627,3704,3731,3777,3840,3894,3951,3982,4043,4138,4226,4271,4406,4458,4500,4581,4600,4684,4759,4804,4942,5010,5073,5136,5191,5226,5353,5420,5489,5523,5583,5647,5711,5751,5820,5888,5934,5960,6018,6031],"hard_ok":[0,0,0,0,0,0,0,0,0,0,0,0,0,0,0,0,0,0,0,0,0,0,0,0,0,0,0,0,0,0,0,0,0,0,0,0,0,0,0,0,0,0,0,0,0,0,0,0,0,0,0,0,0,0,0,0,0,0,0,0,0,0,0,0,0,0,0,0,0,0,0,0,0,0,0,0,0,0,0,0,0,0,0,0,0,0,0,0,0,0,0,0,0,0,0,0,0],"passes":[0,0,0,0,0,0,0,0,0,0,0,0,0,0,0,0,0,0,0,0,0,0,0,0,0,0,0,0,0,0,0,0,0,0,0,0,0,0,0,0,0,0,0,0,0,0,0,0,0,0,0,0,0,0,0,0,0,0,0,0,0,0,0,0,0,0,0,0,0,0,0,0,0,0,0,0,0,0,0,0,0,0,0,0,0,0,0,0,0,0,0,0,0,0,0,0,0],"passes_ok":[0,0,0,0,0,0,0,0,0,0,0,0,0,0,0,0,0,0,0,0,0,0,0,0,0,0,0,0,0,0,0,0,0,0,0,0,0,0,0,0,0,0,0,0,0,0,0,0,0,0,0,0,0,0,0,0,0,0,0,0,0,0,0,0,0,0,0,0,0,0,0,0,0,0,0,0,0,0,0,0,0,0,0,0,0,0,0,0,0,0,0,0,0,0,0,0,0],"saves":[0,0,0,0,0,0,0,0,0,0,0,0,0,0,0,0,1,1,1,1,1,1,1,1,1,1,1,1,1,1,1,1,1,1,1,1,1,1,1,1,1,1,1,1,1,1,1,1,1,1,1,1,1,1,1,1,1,1,1,1,1,1,2,2,2,2,2,2,2,2,2,2,2,3,3,3,3,3,3,3,3,3,3,3,3,3,3,3,3,3,3,3,3,3,3,3,3],"shots":[0,0,0,0,0,0,0,0,0,0,0,0,0,0,0,0,0,0,0,0,0,0,0,0,0,0,0,0,0,0,0,0,0,0,0,0,0,0,0,0,0,0,0,0,0,0,0,0,0,0,0,0,0,0,0,0,0,0,0,0,0,0,0,0,0,0,0,0,0,0,0,0,0,0,0,0,0,0,0,0,0,0,0,0,0,0,0,0,0,0,0,0,0,0,0,0,0],"sprints":[0,0,0,0,0,0,0,0,0,0,0,0,0,0,0,0,0,0,0,0,0,0,0,0,0,0,0,0,0,0,0,0,0,0,0,0,0,0,0,0,0,0,0,0,0,0,0,0,0,0,0,0,0,0,0,0,0,0,0,0,0,0,0,0,0,0,0,0,0,0,0,0,0,0,0,0,0,0,0,0,0,0,0,0,0,0,0,0,0,0,0,0,0,0,0,0,0],"top_speed_dmh":[0,70,70,70,92,92,92,92,92,92,92,92,92,92,92,92,92,92,92,92,92,92,92,95,95,95,95,95,95,95,95,95,95,95,95,95,95,95,95,95,95,95,95,95,95,95,95,95,95,95,95,95,95,95,95,95,95,95,95,95,95,95,95,95,95,95,95,95,95,95,95,95,95,95,95,95,95,95,95,95,95,95,95,95,95,95,95,95,95,95,95,95,95,95,95,95,95]},"team_id":"HAR"},{"off_min":null,"on_min":0.0,"player_id":"HAR-2","position":"DF","shirt_no":2,"stats":{"ball_wins":[0,0,0,0,0,0,0,0,0,0,0,1,2,3,3,3,3,3,3,3,3,3,3,3,3,3,3,3,3,3,3,3,3,3,3,3,3,3,4,4,4,4,4,4,5,5,5,5,5,5,6,6,6,7,7,7,7,7,7,7,7,7,7,7,7,7,7,7,7,7,7,7,7,7,7,7,7,7,7,7,8,8,8,8,8,8,8,8,9,10,10,10,10,11,11,11,11],"distance_m":[0,110,236,270,320,424,579,668,765,945,992,1135,1258,1393,1528,1638,1744,1886,2006,2111,2201,2302,2410,2567,2640,2781,2909,3032,3146,3268,3390,3506,3638,3791,3894,4039,4170,4292,4418,4539,4661,4777,4910,5016,5087,5172,5665,5801,5912,6034,6131,6290,6394,6517,6642,6781,6932,6998,7131,7164,7241,7389,7506,7607,7658,7786,7872,8024,8112,8233,8351,8414,8573,8637,8792,8979,9070,9199,9319,9407,9513,9613,9723,9857,9953,10088,10168,10307,10444,10555,10648,10787,10893,11013,11107,11204,11227],"hard_ok":[0,0,0,0,0,0,0,0,0,0,0,0,0,0,0,0,0,0,0,0,0,0,0,0,0,0,0,0,0,0,0,0,0,0,0,0,0,0,0,0,0,0,0,0,0,0,0,0,0,0,0,0,0,0,0,0,0,0,0,0,0,0,0,0,0,0,0,0,0,0,0,0,0,0,0,0,0,0,0,0,0,1,1,1,1,1,1,1,2,2,2,2,2,3,3,3,3],"passes":[0,0,0,0,0,1,1,1,1,1,1,2,2,2,2,2,2,2,2,3,3,3,5,5,5,7,8,8,8,9,11,11,12,12,12,12,13,13,13,15,15,15,16,16,16,16,16,16,16,17,18,18,18,19,19,19,20,20,20,20,20,20,20,20,20,21,21,22,23,23,23,23,25,25,25,28,28,28,28,28,28,29,29,29,29,29,29,30,31,31,31,31,31,32,32,33,33],"passes_ok":[0,0,0,0,0,1,1,1,1,1,1,2,2,2,2,2,2,2,2,3,3,3,5,5,5,7,8,8,8,9,10,10,11,11,11,11,11,11,11,13,13,13,13,13,13,13,13,13,13,14,15,15,15,16,16,16,17,17,17,17,17,17,17,17,17,18,18,19,19,19,19,19,19,19,19,21,21,21,21,21,21,22,22,22,22,22,22,22,23,23,23,23,23,24,24,25,25],"saves":[0,0,0,0,0,0,0,0,0,0,0,0,0,0,0,0,0,0,0,0,0,0,0,0,0,0,0,0,0,0,0,0,0,0,0,0,0,0,0,0,0,0,0,0,0,0,0,0,0,0,0,0,0,0,0,0,0,0,0,0,0,0,0,0,0,0,0,0,0,0,0,0,0,0,0,0,0,0,0,0,0,0,0,0,0,0,0,0,0,0,0,0,0,0,0,0,0],"shots":[0,0,0,0,0,0,0,0,0,0,0,0,0,0,0,0,0,0,0,0,0,0,0,0,0,0,0,0,1,1,1,1,1,1,1,1,1,1,1,1,1,1,1,1,1,1,1,1,1,1,1,1,1,1,1,1,1,1,1,1,1,1,1,1,1,1,1,1,1,2,2,2,2,2,2,2,2,2,2,2,2,2,2,2,2,2,2,2,2,2,2,2,2,2,2,2,2],"sprints":[0,0,0,0,0,0,0,0,0,1,1,1,1,1,1,2,4,4,4,4,4,4,4,5,5,5,5,6,6,6,6,6,6,7,7,8,8,8,8,8,8,8,9,9,9,9,10,11,11,11,11,12,12,12,12,12,12,12,12,12,12,12,12,12,12,12,12,12,12,12,13,13,13,13,13,14,14,14,14,14,14,14,16,16,16,16,16,16,16,16,16,16,16,16,17,17,17],"top_speed_dmh":[0,159,159,159,159,159,159,237,237,305,305,305,305,305,305,305,305,305,305,305,305,305,305,305,305,305,305,305,305,305,305,305,305,305,305,305,305,305,305,305,305,305,305,305,305,305,305,305,305,305,305,320,320,320,320,320,320,320,320,320,320,320,320,320,320,320,320,320,320,320,320,320,320,320,320,320,320,320,320,320,320,320,320,320,320,320,320,320,320,320,320,320,320,320,320,320,320]},"team_id":"HAR"},{"off_min":72.1,"on_min":0.0,"player_id":"HAR-3","position":"DF","shirt_no":3,"stats":{"ball_wins":[0,1,1,1,1,2,2,2,2,2,2,2,2,2,2,2,2,2,3,4,4,4,4,4,4,4,5,5,5,5,6,6,7,7,7,7,7,8,8,9,9,9,9,10,10,11,11,11,11,12,12,12,12,12,12,12,12,12,12,12,12,12,12,12,12,12,12,12,12,12,12,12,13,13,13,13,13,13,13,13,13,13,13,13,13,13,13,13,13,13,13,13,13,13,13,13,13],"distance_m":[0,111,250,251,276,379,531,607,729,910,959,1105,1248,1406,1544,1638,1760,1885,2022,2111,2198,2275,2401,2567,2633,2790,2919,3013,3125,3249,3369,3486,3587,3740,3861,3997,4127,4242,4372,4499,4583,4683,4803,4906,4983,5047,5553,5675,5800,5918,6020,6180,6294,6426,6571,6718,6879,6920,7049,7089,7160,7311,7423,7532,7613,7737,7831,7981,8070,8205,8334,8391,8526,8585,8585,8585,8585,8585,8585,8585,8585,8585,8585,8585,8585,8585,8585,8585,8585,8585,8585,8585,8585,8585,8585,8585,8585],"hard_ok":[0,0,0,0,0,0,0,0,0,0,0,0,0,0,0,0,0,0,2,2,2,2,2,2,2,2,3,3,3,3,3,3,3,3,3,3,3,3,3,3,3,3,3,3,3,3,3,3,4,5,5,5,5,6,6,6,6,6,6,6,6,6,6,6,6,7,7,7,7,7,7,7,7,7,7,7,7,7,7,7,7,7,7,7,7,7,7,7,7,7,7,7,7,7,7,7,7],"passes":[0,0,0,0,0,0,0,0,0,0,0,1,2,2,2,2,2,3,5,5,5,5,6,6,6,7,9,9,9,10,11,11,12,12,12,12,12,12,13,14,14,14,16,16,16,16,16,16,17,20,20,20,20,22,22,23,24,24,24,24,24,24,24,24,24,25,25,26,27,27,27,27,27,27,27,27,27,27,27,27,27,27,27,27,27,27,27,27,27,27,27,27,27,27,27,27,27],"passes_ok":[0,0,0,0,0,0,0,0,0,0,0,1,2,2,2,2,2,3,5,5,5,5,6,6,6,7,9,9,9,9,10,10,11,11,11,11,11,11,11,12,12,12,13,13,13,13,13,13,14,17,17,17,17,18,18,19,20,20,20,20,20,20,20,20,20,21,21,22,23,23,23,23,23,23,23,23,23,23,23,23,23,23,23,23,23,23,23,23,23,23,23,23,23,23,23,23,23],"saves":[0,0,0,0,0,0,0,0,0,0,0,0,0,0,0,0,0,0,0,0,0,0,0,0,0,0,0,0,0,0,0,0,0,0,0,0,0,0,0,0,0,0,0,0,0,0,0,0,0,0,0,0,0,0,0,0,0,0,0,0,0,0,0,0,0,0,0,0,0,0,0,0,0,0,0,0,0,0,0,0,0,0,0,0,0,0,0,0,0,0,0,0,0,0,0,0,0],"shots":[0,0,0,0,0,0,0,0,0,0,0,0,0,0,0,0,0,0,0,0,0,0,0,1,1,1,1,1,1,1,1,1,1,1,1,1,1,1,1,1,1,1,1,1,1,1,1,1,1,1,1,1,1,1,1,1,1,1,1,1,1,1,1,1,1,1,1,1,1,1,1,1,1,1,1,1,1,1,1,1,1,1,1,1,1,1,1,1,1,1,1,1,1,1,1,1,1],"sprints":[0,1,1,1,1,1,1,1,1,2,2,2,2,2,2,3,4,4,4,4,4,4,5,6,6,6,6,7,8,8,8,8,8,9,9,9,9,9,9,9,9,9,9,10,10,10,12,12,12,12,12,13,14,15,16,16,16,17,17,17,17,17,18,18,18,19,19,19,19,19,20,20,20,20,20,20,20,20,20,20,20,20,20,20,20,20,20,20,20,20,20,20,20,20,20,20,20],"top_speed_dmh":[0,296,296,296,296,296,296,296,296,326,326,326,326,326,326,326,326,326,326,326,326,326,326,328,328,328,328,328,328,328,328,328,328,328,328,328,328,328,328,328,328,328,328,328,328,328,328,328,328,328,328,328,328,328,328,328,328,328,328,328,328,328,328,328,328,328,328,328,328,328,328,328,328,328,328,328,328,328,328,328,328,328,328,328,328,328,328,328,328,328,328,328,328,328,328,328,328]},"team_id":"HAR"},{"off_min":null,"on_min":0.0,"player_id":"HAR-4","position":"DF","shirt_no":4,"stats":{"ball_wins":[0,0,0,0,0,0,1,1,1,1,1,1,1,1,1,1,1,1,1,1,1,1,1,1,1,1,1,1,1,1,2,2,3,3,3,3,3,3,3,4,4,5,5,5,5,5,5,5,5,6,6,6,6,6,6,6,6,6,6,6,6,6,6,6,6,6,6,6,6,6,6,6,6,6,6,6,6,6,6,6,6,6,6,6,6,6,6,6,6,6,6,6,6,6,6,7,7],"distance_m":[0,95,219,220,245,366,498,575,704,877,916,1055,1152,1290,1406,1523,1624,1755,1870,1951,2039,2118,2207,2351,2453,2606,2714,2800,2899,2998,3107,3219,3338,3502,3616,3734,3872,3991,4113,4234,4310,4404,4534,4643,4720,4769,5265,5367,5453,5555,5648,5773,5891,5994,6107,6243,6364,6413,6533,6566,6633,6755,6858,6951,7028,7130,7209,7317,7400,7501,7631,7698,7827,7880,8022,8209,8292,8404,8514,8603,8721,8816,8896,9020,9106,9238,9316,9422,9573,9692,9776,9919,10027,10130,10225,10337,10359],"hard_ok":[0,0,0,0,0,0,0,0,0,0,0,0,0,0,0,0,0,0,0,0,0,0,0,1,1,1,1,1,1,1,1,1,1,1,1,1,2,2,2,2,2,2,2,2,2,2,2,2,2,3,3,3,3,3,3,4,4,4,4,4,4,4,4,4,4,4,4,4,4,4,4,4,4,4,4,4,4,4,4,4,4,4,4,4,4,4,4,4,4,4,5,5,5,5,5,5,5],"passes":[0,0,1,1,1,1,1,1,1,1,1,1,1,2,2,2,3,5,5,6,6,6,6,7,7,9,11,11,11,12,12,12,13,14,14,14,15,16,16,16,16,16,16,18,18,19,19,19,19,21,21,21,21,21,21,22,24,24,24,24,24,24,24,24,24,24,24,24,24,24,24,24,25,25,25,28,28,28,28,28,28,28,28,29,30,30,31,32,32,32,33,33,33,33,33,34,34],"passes_ok":[0,0,1,1,1,1,1,1,1,1,1,1,1,2,2,2,3,5,5,6,6,6,6,7,7,8,9,9,9,10,10,10,11,12,12,12,13,13,13,13,13,13,13,13,13,14,14,14,14,15,15,15,15,15,15,16,17,17,17,17,17,17,17,17,17,17,17,17,17,17,17,17,18,18,18,21,21,21,21,21,21,21,21,22,23,23,24,25,25,25,26,26,26,26,26,27,27],"saves":[0,0,0,0,0,0,0,0,0,0,0,0,0,0,0,0,0,0,0,0,0,0,0,0,0,0,0,0,0,0,0,0,0,0,0,0,0,0,0,0,0,0,0,0,0,0,0,0,0,0,0,0,0,0,0,0,0,0,0,0,0,0,0,0,0,0,0,0,0,0,0,0,0,0,0,0,0,0,0,0,0,0,0,0,0,0,0,0,0,0,0,0,0,0,0,0,0],"shots":[0,0,0,0,0,0,0,0,0,0,0,0,0,0,0,0,0,0,0,0,0,0,0,0,0,0,0,0,0,0,0,0,0,0,0,0,0,0,0,0,0,0,0,0,0,0,0,0,0,0,0,0,0,0,0,0,0,0,0,0,0,0,0,0,0,0,0,0,0,0,0,0,0,0,0,0,0,0,0,0,0,0,0,0,0,0,0,0,0,0,0,0,0,0,0,0,0],"sprints":[0,0,0,0,0,0,0,0,0,1,1,1,1,1,1,2,3,3,3,3,3,3,3,5,5,5,5,5,6,6,6,6,6,8,8,8,8,8,8,8,8,8,8,8,8,8,9,9,9,9,9,10,11,11,11,11,11,11,11,11,11,11,11,11,11,11,11,11,11,11,12,12,12,12,12,14,14,14,14,14,14,14,14,15,15,15,15,15,15,15,15,16,16,16,17,18,18]